Date,Client,Hours,Description
2026-06-03,AZDOA,0.75,ADOA Data Cloud Project Working SessionADOA Data Cloud Project Working Session (https://meet.google.com/oid-hctd-wky) (https://meet.google.com/oid-hctd-wky)
2026-06-03,AZDOA,0.25,Touch base with Riely
2026-06-01,AZDOA,0.75,SFPT Snowflake connector documentation research
2026-06-01,AZDOA,1.0,ADOA Data Cloud Project Working Session
2026-05-28,AZDOA,0.25,Onboarding Meeting with Riely
2026-06-04,AZDOA,0.5,ADOA Data Cloud Project Working Session (https://meet.google.com/cmt-iooa-xab)
