Date,Client,Hours,Description
2026-06-12,University of Alaska,1.0,Final TRX Freeze comparisons
2026-06-12,OFM,3.75,Adding Upoad functionality to UI - not backend yet
2026-06-12,OFM,0.75,Adjusting naming convention functionality for UI
2026-06-15,CODOR,0.25,Redo Background check and send form to client
2026-06-15,OFM,0.5,Upload Tools and Error-Handling Project Standup (Microsoft Teams Meeting) + Meeting prep
2026-06-15,CDOT,1.25,IPU Recommendation Implementation
2026-06-15,University of Alaska,0.5,Freeze TRX Sync 
