Date,Client,Hours,Description
2026-06-03,AZDOA,0.75,ADOA Data Cloud Project Working SessionADOA Data Cloud Project Working Session (https://meet.google.com/oid-hctd-wky) (https://meet.google.com/oid-hctd-wky)
2026-06-03,OFM,0.25,Upload Tools and Error-Handling Project Standup (Microsoft Teams Meeting)
2026-06-03,OFM,0.5,Quick meeting with Natalia on RAAs columns
2026-06-03,OFM,1.25,Changing reports available for other transaction types and adding new tooltip text from meeting
2026-06-03,OFM,0.5,Upload Tools and Error Handling Requirements Refinement meetings (Microsoft Teams Meeting)
2026-06-03,OFM,0.5,Meeting Prep and tooltip refinement
2026-06-03,OFM,0.5,Adjusting procedures to match new naming conventions from refinement meeting and refactoring error message table columns
2026-06-03,University of Alaska,1.5,Adjusting github migration documentation
2026-06-03,University of Alaska,0.25,UA Development Touch Base (Microsoft Teams Meeting)
2026-06-03,CDOT,0.5,New MD5 POC Development and meeting prep
2026-06-03,AZDOA,0.25,Touch base with Riely
