Date,Client,Hours,Description
2026-04-28,OFM,0.25,Upload Tools and Error-Handling Project Standup (Microsoft Teams Meeting)
2026-04-28,OFM,0.75,Develupment Error Handling
2026-04-28,OFM,0.5,Touch Base with Natalia
2026-04-28,University of Alaska,0.5,tf_banner_freeze fix email notifications
2026-04-28,CDOT,1.0,Working Session with Alex
2026-04-28,CDOT,0.5,CDOT VPN Setup
2026-04-28,University of Alaska,0.5,NSC Working Session (Microsoft Teams Meeting)
2026-04-28,University of Alaska,0.5,UA DE Working Session (Microsoft Teams Meeting)
