Date,Client,Hours,Description
2026-04-09,CDOT,1.5,Login setup and create the progress tracker document
2026-04-09,OFM,0.25,Upload Tools and Error-Handling Project Standup (Microsoft Teams Meeting)
2026-04-09,OFM,0.25,Pre morning meeting check in with Natalia
2026-04-09,OFM,0.75,Error Handling Working Session with Natalia
2026-04-09,OFM,1.25,Error Handling Corrections and develupment
2026-04-09,University of Alaska,0.5,Inventory Finalization and Upload
2026-04-09,OFM,0.75,Demo Meeting Preperation
2026-04-10,OFM,1.0,Technical Team Placeholder-Upload Tools and Error Handling Project  (Microsoft Teams Meeting)
2026-04-10,University of Alaska,0.75,UA Development Touch Base & Documentation Review (Microsoft Teams Meeting)
2026-04-10,University of Alaska,0.75,Apply Inventory Documentation to the unit testing sheet
2026-04-10,OFM,1.0,Investigation of CUSTOMER_INVOICE script
