Date,Client,Hours,Description
2026-06-17,AZDOA,0.5,DoA Planning (Microsoft Teams Meeting)
2026-06-17,AZDOA,0.5,Informatica / Snowflake Develupment
2026-06-17,AZDOA,0.5,Upload Tools and Error-Handling Project Standup (Microsoft Teams Meeting)
2026-06-17,OFM,0.5,OFM Upload Procedures Sync (Microsoft Teams Meeting)
2026-06-17,University of Alaska,3.5,Procedures Development (File upload and file creation via API)
2026-06-17,University of Alaska,0.5,UA Development Touch Base (Microsoft Teams Meeting)
2026-06-17,University of Alaska,1.25,OFM Working Session (Microsoft Teams Meeting)
